Date,Title,articleLead,articleText,url"25 April, 14:02",Российский Генштаб сообщил о сбитых у базы «Хмеймим» беспилотниках,"Системы ПВО российской авиабазы «Хмеймим» в Сирии 24 апреля сбили два беспилотника боевиков. Об этом на брифинге заявил начальник Главного оперативного управления Генштаба Вооруженных сил России генерал-полковник Сергей Рудской, передает «Интерфакс».","«Вчера в 20 часов вечера российскими средствами ПВО на удалении 10 километров от аэродрома „Хмеймим“ были обнаружены и уничтожены два беспилотных летательных аппарата боевиков», — сказал он. Накануне представитель базы  сообщил , что ПВО сбили «малоразмерные воздушные цели». При этом никто не пострадал, база продолжила работу в плановом режиме. В начале января Минобороны  сообщило , что российские военные предотвратили атаку 13 беспилотников на аэродром «Хмеймим» и портовую базу Тартус в Сирии. По утверждению ведомства, никто не пострадал, ущерб базам не был нанесен. Затем ведомство опубликовало  фотографии  перехваченных тогда дронов из досок и фанеры, обмотанных зеленым полиэтиленом и скотчем, с торчащими проводами. Комментируя этот инцидент, президент Владимир Путин  заявил , что, несмотря на примитивный внешний вид беспилотников, в них были элементы высокотехнологичного характера, которые не могли быть изготовлены кустарным образом. Он тогда выразил уверенность, что «ни турецкие военные, ни руководство Турции не имеют отношения к этому инциденту», хотя атаковавшие базу Хмеймим беспилотники были выпущены с территории сирийской провинции Идлиб, которую должна контролировать Турция. «Коммерсантъ» 3 января  сообщил , что 31 декабря радикальные исламисты обстреляли из минометов авиабазу «Хмеймим». В результате были уничтожены четыре бомбардировщика Су-24, два истребителя Су-35С, военно-транспортный самолет Ан-72 и склад с боеприпасами. В Минобороны эту информацию назвали фейком.",https://tvrain.ru/news/hmejmim_bespilotnikah-462574/
"26 April, 01:04",Reuters связал ответные санкции России с итогами переговоров Трампа с ЕС,"Москва не торопится вводить меры в ответ на новые санкции США в отношении компании Rusal в надежде на то, что Евросоюз сможет убедить Вашингтон ослабить эти ограничения,  пишет  Reuters.","В понедельник США дали американским клиентам Rusal больше времени для того, чтобы привести свои операции с компанией в соответствие с требованием санкций. Это произошло в результате лоббирования со стороны нескольких европейских стран, напоминает Reuters. «Французский президент Эммануэль Макрон уже находится в Вашингтоне, а немецкий канцлер Ангела Меркель планирует направиться туда позднее на этой неделе. Москва надеется, что оба лидера смогут снова открыть европейские рынки для алюминия Rusal», — пишет агентство со ссылкой на источник в российском Минфине. «Все сидят и ждут, согласится ли Меркель с Трампом, добьется ли она исключений. Это объясняет, почему Россия сейчас не расчехляет в ответ все орудия», — сказал собеседник Reuters. Он отметил, что многих попавших под санкции лиц они застали врасплох. «Наша сторона не думала, что будет такое давление, но Запад этого тоже не ожидал. Поэтому предпринимаются попытки ослабить давление с обеих сторон», — добавил источник. Новые санкции в отношении России США ввели шестого апреля. Под них попал, в частности, бизнесмен Олег Дерипаска и связанный с ним Rusal. 23 апреля в Минфине США  допустили  снятие с компании ограничений в случае продажи Дерипаской 48% ее акций. 19 апреля The Wall Street Journal сообщала, что немецкий бизнес в связи с новыми санкциями попросил Меркель и министра финансов Германии Олафа Шольца добиться от Вашингтона исключений для компаний из Германии, ведущих дела с Россией. В Госдуме 15 мая в первом чтении должны рассмотреть законопроект об ответных санкциях в отношении США, ограничивающий импорт в Россию некоторых американских товаров, включая лекарства.",https://tvrain.ru/news/cankcii-462623/
"26 апреля, 16:47",ФБК назвал взяткой покупку Прохоровым у Хлопонина виллы за 35 млн евро,"Вице-премьер Александр Хлопонин продал виллу в Италии офшору бизнесмена Михаила Прохорова за 35,5 миллиона евро,  пишет  основатель Фонда борьбы с коррупцией (ФБК) Алексей Навальный со ссылкой на копию договора купли-продажи. Он назвал это «оформлением взятки», так как, по оценкам ФБК, такая вилла должна стоить втрое дешевле.","24 апреля Русская служба Би-би-си  сообщила , что Хлопонин за 2017 год  задекларировал  рекордно большой доход  —  2,9 миллиарда рублей — после продажи Прохорову виллы и участка земли в Италии. Журналисты подсчитали, что чиновник мог продать свою недвижимость примерно за 2,89 миллиарда рублей или 44 миллиона евро. Навальный опубликовал  копию  договора купли-продажи этой виллы и обратил внимание, что там указана цена сделки и ее дата — 24 апреля 2017 года. Продавцами в документе указаны Александр и Наталья Хлопонины, покупателем — офшор Magora Trading. Он принадлежит кипрской компании Neptolino Holdings, собственником которой в кипрском  реестре  назван Михаил Прохоров, пишет Навальный. По словам Навального, предметом сделки стал дом общей площадью 400 квадратных метров, гостевой дом площадью 200 квадратных метро и дом прислуги — 150 квадратных метров. Они расположены на участке площадью 8 тысяч квадратных метров. «Би-би-си» делала расчеты на информации, которую Хлопонин указывал в декларации: 818 квадратных метров. Опрошенные журналистами риелторы оценили предмет сделки в пределах от семи до двадцати миллионов евро. Навальный сравнил сумму в договоре с объявлениями о продаже недвижимости по соседству. Похожие по размерам и ценовому уровню здания с участками, по его словам, продаются за пять-десять миллионов евро, то есть, по меньшей мере, в три раза дешевле. Он сделал вывод, что дом Хлопонина, расположенный далеко от моря, «не может стоить 35 миллионов евро», и ни один «здравомыслящий человек» ее за такие деньги не купит. «Но Прохоров-то заплатил 35, в три раза больше. Почему? Потому что Прохоров покупает себе не средненького пошиба виллу (которая ему-то уж точно не нужна), а одного из высших чиновников правительства России. И тут самое время вспомнить, что Хлопонин курирует  недропользование , а интересы Прохорова связаны именно с этой сферой», — сделал вывод основатель ФБК. Представитель группы «ОНЭКСИМ» (принадлежит Прохорову) Андрей Беляк не смог оперативно прокомментировать Дождю публикацию Навального, ответа на вопрос по электронной почте пока не поступило. Прохоров и Хлопонин  учились  в одной группе на факультете экономики Московского финансового института. В 1996 году Хлопонин стал гендиректором «Норникеля», одним из акционеров которого был Прохоров. Когда Хлопонин был губернатором Красноярского края, Прохоров получил постоянную регистрацию в красноярском поселке Еруда Северо-Енисейского района и платил налоги в краевой бюджет. У Прохорова давно уже нет новых крупных проектов в России, зато активно развивается спортивный и девелоперский бизнес в США, писали «Ведомости» со ссылкой на знакомого Прохорова. С 2015 года Прохоров только продает российские активы. В феврале 2018 года он продал последние принадлежавшие ему акции UC Rusal. 6% Rusal у «ОНЭКСИМа» купил консорциум «Реновы» Виктора Вексельберга и Access Industries Леонарда Блаватника.",https://tvrain.ru/news/fbk_nazval_vzjatkoj_pokupku_prohorovym_u_hloponina_villy_za_35_mln_evro-462663/
"25 April, 15:39",Дворкович заявил о согласовании места фан-зоны ЧМ возле МГУ. Студенты это отрицают,"Для размещения фан-зоны Чемпионата мира по футболу рядом с МГУ на Воробьевых горах найдено решение, которое устроит всех, заявил вице-премьер, председатель оргкомитета «Россия-2018» Аркадий Дворкович. Об этом  сообщает  «Интерфакс». Требовавашие переноса фан-зоны студенты отрицают, что компромисс найден.","«МГУ заканчивает согласование по конкретной площадке, найдено решение, устраивающее все заинтересованные стороны», — сказал Дворкович. Фан-зону разместят не на территории МГУ, а рядом, и там не будут размещать другие связанные с ЧМ-2018 объекты, которые раньше собирались установить на территории вуза, уточнил вице-премьер. Он назвал это решение «приемлемым» и подчеркнул, что его нашли городские власти и МГУ. Гендиректор оргкомитета «Россия-2018» Алексей Сорокин  подчеркнул , что организаторы пошли на уступки и сократили вместимость фан-зоны, а также убрали часть объектов. Изначально фан-зона была рассчитана на 42,5 тысячи человек. При этом инициативная группа студентов МГУ отрицает, что проблеме было найдено компромиссное решение. Там подчеркнули, что единственной просьбой группы был перенос фан-зоны на альтернативную площадку. Кроме того, студенты отметили, что Дворкович и Сорокин «манипулируют фактами» и выдают за компромисс решения, принятые в августе прошлого года. В связи с первоначальным планом, который был представлен весной 2017 года, для болельщиков планировали обустроить площадку от Университетской площади до Смотровой площадки на Воробьевых горах с пешеходной зоной, торговыми палатками, сценой с видеоэкраном и светомузыкальным фонтаном. Студентов и абитуриентов туда предполагалось пускать только по спецпропускам. В феврале пресс-служба МГУ сообщила, что на время чемпионата на территорию МГУ будут пускать только студентов, сотрудников и абитуриентов. Речь шла о границах ограждений, установленных на проспекте Вернадского, Университетском, Мичуринском и Ломоносовском проспектах. Вуз обещал не вводить никаких изменений для заселения и проживания в университетских общежитиях. Летом 2017 года студенты МГУ выступили против обустройства фан-зоны у главного здания. Они начали собирать подписи, создали тематические сообщества в  фейсбуке  и « ВКонтакте » и в марте  передали  Дворковичу требование перенести фан-зону на ВДНХ. 9 апреля на закрытой встрече с вице-премьером и представителями оргкомитета студентам пообещали рассмотреть другие варианты ее размещения. В сообществе против фан-зоны «ВКонтакте»  опубликовали  ответ из Кремля, в котором говорится, что смотровая площадка у МГУ — единственная территория в Москве, которая соответствует требованиям FIFA, чтобы место было узнаваемым, связываемым с городом, удобным с точки зрения транспортной доступности и достаточной вместимости.",https://tvrain.ru/news/dvorkovich-462579/
"25 April, 01:56",«АвтоВАЗ» поднимет цены на машины из-за падения курса рубля,"«АвтоВАЗ» планирует с первого мая поднять рекомендуемые розничные цены на все свои машины,  сообщает  газета «Ведомости» со ссылкой на топ-менеджеров двух крупных дилерских компаний. По их словам, цены поднимутся на 1-2% в зависимости от модели машин и их комплектации.","Представитель «АвтоВАЗа» подтвердил эту информацию, объяснив рост цен курсовыми колебаниями. Президент «АвтоВАЗа» Николя Мор ранее говорил, что часть компонентов для машин Lada закупают за рубежом и что локализация в производстве этой модели составляет около 85%. Как именно изменятся цены на конкретные модели, пока не известно. В данный момент машины Vesta продаются по цене не менее 569900 рублей, а вторая по популярности модель — Granta — по цене от 399900 рублей. Если цена вырастет на 2%, стоимость базовых версий этих машин поднимется на 8-11 тысяч рублей. «Мы не прогнозируем падения спроса, поскольку изменения в цене незначительные и сохраняют ценовые преимущества Lada на рынке», — отметил представитель «АвтоВАЗа». Это будет уже вторым с начала года повышением рекомендуемых розничных цен на машины «АвтоВАЗа». В январе они поднялись на 2-3%. В 2017 году «АвтоВАЗ» поднимал цены дважды. В январе они поднялись в среднем на 2% на некоторые модели, а в сентябре на 2% подорожала Vesta. Опрошенные «Ведомостями» дилеры считают, что повышение цен на 1-2% вряд ли отразится на спросе, так как оно небольшое и произойдет одновременно с ростом стоимости машин других марок. Renault, к примеру, с 16 апреля подняла цены на на свои автомобили в среднем на 3,8%.",https://tvrain.ru/news/mashiny-462545/
"25 April, 03:00",Кредитование России из-за рубежа резко сократилось,"Кредитование из-за рубежа российских резидентов — компаний, банков, граждан и государства — в четвертом квартале 2017 года упало после недолгого периода роста, говорится в новом отчете Банка международных расчетов. На него  обратил  внимание РБК.","В октябре-декабре прошлого года объем долговых требований к российским резидентам сократился на 8,05 миллиарда долларов по сравнению с третьим кварталом. Снижение в основном произошло из-за сокращения кредитов иностранных банков российским резидентам и оттока из России депозитов, полученных от нерезидентов. До этого показатели по трансграничному кредитованию росли в течение трех кварталов подряд — на 2, затем 3,76 и 2,6 миллиарда долларов соответственно. В последний раз такой последовательный рост был зафиксирован пять лет назад — с июня 2012 года по март 2013-го. За ним последовали 15 кварталов падения, по результатам которых объем выданных российским резидентам кредитов из-за рубежа упал на 107 миллиардов долларов. Тенденцию ускорили введение санкций против России и падение цен на нефть в 2014 году. Пик сокращения, как следует из отчета, был достигнут в четвертом квартале 2014 года, когда кредитование упало на 17,5 миллиарда долларов. В конце 2017 года серьезные санкции в отношении России фактически введены не были, однако в США обсуждали возможность запрета на покупку российского госдолга. Помимо этого в августе 2017 года был подписан американский закон о новых санкциях против России, позволявший исполнительной власти в Вашингтоне вводить подобные ограничения. В конце октября Минфин США заявил, что санкции могут распространиться и на иностранных граждан и компании, работающие с попавшими под санкции лицами и структурами, напоминает РБК.",https://tvrain.ru/news/kreditovanie-462546/
