Date,Title,articleLead,articleText,url
"26 апреля, 20:50",В Иркутской области закрыли дело против полицейских о пытках многодетной матери,"Следователи четыре месяца назад прекратили уголовное дело против полицейских, которых ранее обвиняли в пытках жительницы Иркутской области Марины Рузаевой. В течение этого времени они не сообщали об этом ни потерпевшей, ни ее защите,  написал  у себя в фейсбуке фонд «Общественный вердикт» со ссылкой на соответствующее постановление.","В сообщении говорится, что следователь Александр Корнев прекратил расследование уголовного дела еще 29 декабря 2017 года «из-за отсутствия состава преступления». В постановлении отмечается, что судмедэкспертизы не подтвердили версию о том, что к Рузаевой применялись пытки электрошокером. Дополнительные экспертизы, которые были позже назначены следствием, установили, что возможность установить применение электрошокера «безвозвратно утрачена», говорится в постановлении. Следователь также сообщил, что в деле нет фотографий, которые бы могли доказать применение пыток. В «Общественном вердикте», юрист которого Яков Ионцев ведет дело Рузаевой, в свою очередь, отметили, что фотографии телесных повреждений женщины есть у защиты. По словам Ионцева, «версия Рузаевой правдоподобна и последовательна, подтверждена в ходе следственного эксперимента». Юрист подчеркнул, что эксперты тоже подтвердили наличие телесных повреждений у женщины. В «Общественном вердикте» добавили, что решение о прекращении дела защита намерена обжаловать. В декабре 2016 года следствие  предъявило  обвинение троим полицейским Денису Самойлову, Александру Корбуту и Станиславу Гольченко. Им вменяли превышение должностных полномочий с применением насилия (п. «а, б», ч. 3, ст. 286 УК). По словам правозащитников, вечером 2 января двое мужчин в гражданской одежде пришли домой к Рузаевой. Они показали  удостоверения и попросили женщину проехать в ОВД, сославшись на то, что им нужна помощь в раскрытии преступления. В участке, по данным «Общественного вердикта», Рузаеву заставили разуться, после чего пристегнули наручниками к скамейке, надели на голову пакет и избивали более пяти часов. Полицейские били женщину по голове и пытали электрошокером, требуя признаний в убийстве, отметили в фонде.",https://tvrain.ru/news/pytki_zhenschiny-462686/
"26 апреля, 20:33",Бывшего директора ЦРУ Майка Помпео утвердили на посту госсекретаря США,"Сенат США утвердил на должности главы Госдепартамента Майка Помпео, бывшего директора ЦРУ. За него проголосовали 57 сенаторов, против — 42,  сообщает  Reuters.","Президент Дональд Трамп  предложил  кандидатуру Помпео на пост госсекретаря 13 марта. В тот же день он отправил в отставку с этой должности бывшего руководителя Exxon Mobil Рекса Тиллерсона. Президент объяснил, что с Тиллерсоном у него не было понимания по ряду вопросов внешней политики, и выразил уверенность, что Помпео «сделает фантастическую работу». Против Помпео выступали сенатор-демократы, которые опасались, что у него сложились слишком тесные отношения с президентом.  В середине апреля, выступая перед конгерссменами, Помпео в ответ на вопрос о России  напомнил  о словах президента Владимира Путина о том, что распад СССР был величайшей геополитической катастрофой XX века. Как заявил Помпео, из этого можно сделать вывод о том, что цель российского лидера — вернуть своей стране былое могущество и имидж ядерной державы, а также ослабить американское влияние по всему миру. Для противодействия этому он призвал использовать давление во всех сферах, включая дипломатию, экономику и киберпространство. За три недели до утверждения в должности Трамп послал Помпео в КНДР для встречи с северокорейским лидером Ким Чен Ыном в преддверии двустороннего саммита. Также новому госсекретарю предстоит вести работу с европейскими союзниками в вопросе о возможном ужесточении санкций против Ирана.",https://tvrain.ru/news/senat-462685/
"26 April, 11:21",Глава МИД и вице-премьер Армении проведут переговоры в Москве,"Исполняющий обязанности первого вице-премьера Армении Армен Геворкян утром 26 апреля отправился в Москву, где проведет рабочие переговоры. Об этом сообщает « Интерфакс » со ссылкой на пресс-службу армянского правительства.","Источник «Интерфакса» также рассказал, что в Москве уже находится глава МИД Армении Эдвард Налбандян, он планирует провести встречи с «российскими официальными лицами». По словам собеседника агентства, на переговорах будут обсуждаться вопросы, связанные с внутриполитическим кризисом в Армении и российско-армянские отношения. Накануне  стало известно , что российские дипломаты встретились с лидером оппозиции Армении Николом Пашиняном. На встрече также присутствовали соратник Пашиняна Арарат Мирзоян и пресс-секретарь партии «Гражданский договор» Тигран Авинян. Дипломаты призвали организаторов протестов «к конструктивному диалогу с действующими властями и другими политическими силами».  «Сегодня я встречался с официальными представителями России и получил конкретные заверения о том, что Москва не будет вмешиваться во внутренние дела Армении», — сказал Пашинян в среду, 25 апреля, во время митинга на площади Республики в центре Еревана.  С 13 апреля в Ереване проходили акции протеста против избрания бывшего президента страны Сержа Саргсяна премьер-министром. 23 апреля Саргсян подал в отставку. Позже Пашинян  объявил  о продолжении акций протеста. Это произошло после провала переговоров оппозиции с временно исполняющим обязанности премьер-министра Кареном Карапетяном. Новым требованием протестующие называют уход правящей Республиканской партии Армении.  25 апреля оппозиционный депутат Арарат Мирзоян  объявил , что Карапетян подал в отставку. Однако в пресс-службе правительства Армении заявили, что Карапетян продолжает исполнять обязанности премьер-министра.",https://tvrain.ru/news/glava_mid_i_vitse_premer_armenii-462639/
"26 апреля, 19:55",Прохоров подаст в суд из-за расследования ФБК о покупке виллы у Хлопонина,"Михаил Прохоров подаст иск о клевете к Фонду борьбы с коррупцией (ФБК) Алексея Навального из-за расследования о покупке виллы в Италии у вице-премьера Александра Хлопонина. Об этом Дождю сообщили в пресс-службе группы «ОНЭКСИМ», которую контролирует Прохоров.","Представитель группы назвал ложью утверждение Алексея Навального о том, что покупка виллы по завышенной цене была взяткой. Он заверил, что сделка «была абсолютно прозрачной». «Будем подавать иск о клевете», — сказал он. Хлопонин продал виллу в Италии офшору бизнесмена Михаила Прохорова за 35,5 миллиона евро, говорится в новом  расследовании  ФБК. Навальный назвал это «оформлением взятки», так как, по оценкам ФБК, такая вилла должна стоить втрое дешевле. Хлопонин за 2017 год  задекларировал  рекордно большой доход  —  2,9 миллиарда рублей. 24 апреля Русская служба Би-би-си  сообщила , что  это стало возможным после того, как он продал виллу и участок земли в Италии Прохорову.  Журналисты подсчитали, что чиновник мог продать свою недвижимость примерно за 2,89 миллиарда рублей или 44 миллиона евро. Навальный сравнил сумму в договоре о сделке с объявлениями о продаже недвижимости по соседству. Похожие по размерам и ценовому уровню здания с участками, по его словам, продаются за пять-десять миллионов евро, то есть, по меньшей мере, в три раза дешевле. Он сделал вывод, что дом Хлопонина, расположенный далеко от моря, «не может стоить 35 миллионов евро», и ни один «здравомыслящий человек» ее за такие деньги не купит. По его мнению, за счет этой сделки Прохоров  «купил»  «одного из высших чиновников правительства России», который курирует недропользование. Прохоров и Хлопонин вместе учились в Московском финансовом институте. В 1996 году Хлопонин стал гендиректором «Норникеля», одним из акционеров которого был Прохоров. Когда Хлопонин был губернатором Красноярского края, Прохоров получил постоянную регистрацию в красноярском поселке Еруда Северо-Енисейского района и платил налоги в краевой бюджет. Расследования ФБК уже становились поводом для исков о клевете. Год назад Люблинский суд Москвы  обязал  Навального и его фонд опровергнуть недостоверную информацию о бизнесмене Алишере Усманове в фильме «Он вам не Димон». Претензии предпринимателя были связаны с утверждением о том, что он якобы дал взятку премьер-министру Дмитрию Медведеву через пожертвование земельного участка с постройками в селе Знаменское фонду «Соцгорпроект», связанную председателем правительства. В октябре 2017 году иск о клевете у ФБК выиграл фонд «Соцгоспроект», набсовет которого возглавляет однокурсник премьер-министра Дмитрия Медведева Илья Елисеев. Поводом для иска стало то же расследование.",https://tvrain.ru/news/prohorov_podast_isk-462682/
"25 April, 19:58",Роскомнадзор назвал безрезультатными переговоры с Amazon по блокировке Telegram,"Переговоры с компанией Amazon по ситуации, связанной с блокировкой мессенджера Telegram, к положительным результатам пока не привели. Об этом замглавы Роскомнадзора Вадим Субботин  сообщил  на встрече с представителями IT-индустрии по вопросу блокировки Telegram.","Он рассказал, что Роскомнадзор продолжает рабочие контакты с Amazon и Google о прекращении предоставления Telegram IP-адресов для работы мессенджера в России в нарушение решения суда. Отсутствие положительных результатов в переговорах с Amazon Субботин связал с политическими причинами. «Напротив, взаимодействие с Google становятся более конструктивным, начат предметный диалог», — говорится в сообщении. Таганский суд Москвы 13 апреля принял решение заблокировать Telegram из-за отказа предоставить ФСБ ключи шифрования к переписке пользователей. Роскомнадзор начал блокировать мессенджер с 16 апреля. На следующий день ведомство  уведомило  Amazon и Google о блокировке их IP-адресов, которые мессенджер Telegram использует для обхода блокировок. После этого пользователи начали жаловаться на проблемы с доступом к различным ресурсам из-за блокировок.",https://tvrain.ru/news/telegram-462603/
"25 April, 10:49",Пострадавший во время урагана в Москве умер в больнице,"В Москве в одной из больниц умер мужчина, пострадавший во время урагана 21 апреля. Об этом «Интерфаксу»  сообщил  информированный источник.","По его словам, состояние пострадавшего было крайне тяжелое, и врачи не смогли его спасти. На утро 25 апреля в больницах города остаются 11 пострадавших из-за урагана. Ранее мэр Москвы Сергей Собянин сообщал, что в результате урагана пострадали 12 человек и погиб один ребенок. Девочка умерла в больнице, ее состояние было крайне тяжелым, и спасти ее не удалось. Власти города решили выплатить семье погибшей один миллион рублей. Пострадавшим, которые были госпитализированы, обещали выплатить по 500 тысяч рублей, тем, кому медицинскую помощь оказывали амбулаторно, — по 100 тысяч рублей. Это второй сильный ураган в Москве за последний год. Предыдущий произошел 29 мая 2017 года. Его жертвами стали 16 человек, еще 200 получили травмы. Были повреждены более 30 тысяч деревьев, более двух тысяч автомобилей, кровли сотен зданий.",https://tvrain.ru/news/postradavshij_vo_vremja-462561/
