Date,Title,articleLead,articleText,url"25 April, 21:38",Шарль Азнавур попал в больницу в Петербурге в день своего концерта,"В Санкт-Петербурге госпитализировали французского эстрадного певца Шарля Азнавура. Об этом  сообщает  «Интерфакс» со ссылкой на директора БКЗ «Октябрьский» Эмму Лавринович, где 25 апреля должен был пройти концерт исполнителя.","По словам Лавринович, певцу стало плохо на репетиции. «Его увезли в одну из больниц Петербурга, которую он сам выбрал. Ничего катастрафического, просто почувствовал себя нехорошо. Врачи установят диагноз», — отметила директор БКЗ «Октябрьский». Концерт Азнавура отменили, добавила Лавринович. Теперь обсуждают дату нового выступления певца, которое может состояться «в этих же числах в 2019 году». «Деньги за билеты всем желающим будут возвращены», — сказала Лавринович. На сайте концертного зала «Октябрьский», где должно было состояться выступление Азнавура,  сообщается , что концерт перенесен на 9 апреля следующего года.  Шарль Азнавур — французский шансонье армянского происхождения. Он считается одним из самых популярных эстрадных певцов XX века.",https://tvrain.ru/news/sharl_aznavur-462612/
"25 April, 12:33","Reuters: российские наемники, воюющие в Сирии, используют военную часть на Кубани","За последний месяц три группы мужчин, вернувшихся из Дамаска, отправлялись на базу Минобороны в Молькино под Краснодаром,  пишет  Reuters. Агентство предполагает, что они работают в российских частных военных компаниях.","Автобусы с прибывшими из Дамаска группами людей в гражданском ездили в Молькино из аэропорта 25 марта, 6 апреля и 17 апреля. Их видели корреспонденты Reuters. 17 апреля несколько групп мужчин прилетели в Ростов-на-Дону чартерным самолетом авиакомпании Cham Wings. В аэропорту они прошли через служебные помещения и отправились в сторону Молькино на нескольких автобусах. На КПП базы Минобороны каждый из автобусов остановился «на одну-две минуты» и проехали дальше. В этот момент там дежурили двое военных. Reuters отмечает, что, согласно спутниковым картам, эта дорога ведет в воинскую часть Минобороны. На базе в Молькино находится 10-я отдельная бригада специального назначения российского Минобороны. Дежурный офицер бригады сообщил Reuters, что на базу «никто не заезжает». «Ну, видели и видели. Не всему можно, как говорится, верить», — сказал он. Несколько родственников, друзей и вербовщиков частных бойцов рассказали Reuters, что в Молькино находится тренировочный лагерь бойцов со времен боев на Украине. Источники Reuters также говорят, что авиакомпания Cham Wings перевозит частных бойцов из России в Сирию и обратно. 5 апреля Reuters впервые  сообщил  о перелетах Cham Wings между Дамаском и Ростовом-на-Дону, которых нет в расписании ростовского аэропорта Платов. Корреспонденты агентства видели, что на этих самолетах из России в Сирию вылетают «люди в камуфляже». За 14 месяцев с 5 января 2017 года Cham Wings совершила 51 полет из Дамаска и Латакии в Ростов и обратно. Компания Cham Wings с 2016 года находится под санкциями США. В марте издание Znak публиковало фотографии базы в Молькине. Журналисту издания удалось пройти внутрь после того, как на охране он сказал, что едет «в Сирию». Как пишет издание, на КПП стоят военнослужащие ГРУ в бронежилетах и касках, вооруженные штык-ножом. Внутри находятся три двухэтажных дома, облицованные сайдингом салатового цвета, с зелеными крышами. Журналист отметил, что это казармы.  Впервые о существовании частной военной компании Вагнера  сообщило  издание «Фонтанка» в 2016 году. Издание связало деятельность организации с бизнесменом Евгением Пригожиным. Пригожин в ноябре 2017 года заявил, что не имеет к этой компании никакого отношения. Создание и участие в частных военных компаниях в России в настоящий момент подпадает под действие статьи Уголовного кодекса «наемничество». Власти не раз отрицали существование частных военных компаний. Пресс-секретарь президента Дмитрий Песков 14 февраля сказал, что гражданские россияне, находящиеся в Сирии, «не относятся к вооруженным силам Российской Федерации».",https://tvrain.ru/news/reuters_vojujuschie_v_sirii_chastnye_bojtsy_462565-462565/
"25 April, 12:47",Мосгордума приняла закон о продлении голосования на выборах мэра,Мосгордума приняла в окончательной редакции законопроект о внесении изменений в избирательный кодекс Москвы. Об этом  сообщается  на сайте законодательного собрания столицы.,"Председатель Мосгордумы Валентин Горбунов рассказал, что ко второму чтению поступило 28 поправок, из них 27 были поддержаны. Одна из поправок предполагает продление голосования на выборах в Москве с 20 до 22 часов. На выборах мэра столицы избиратели теперь смогут проголосовать не по месту регистрации, а по месту нахождения. Ранее эта возможность была предоставлена избирателям на выборах президента России в марте 2018 года. Кроме того, была увеличена предельная сумма расходов средств избирательных фондов кандидатов в мэры города до 250 миллионов рублей, в депутаты Мосгордумы — до 25 миллионов рублей, на должность главы муниципального образования — до 800 тысяч рублей. Необходимость принятия этой поправки объяснили ростом цен на транспортные услуги, аренду помещений, типографские, аудиовизуальные услуги и расходные полиграфические материалы. Также снизили с 1 до 0,5%, количество подписей избирателей, необходимых для регистрации кандидата на должность мэра Москвы. Мэр Москвы Сергей Собянин 16 апреля  внес  в Мосгордуму законопроект о продлении голосования на выборах мэра до 22:00.  В документе отмечается, что это будет удобно москвичам, в том числе тем, кто в выходные уезжает за город. Председатель комиссии МГД по науке и промышленности Леонид Зюганов  раскритиковал  эту инициативу. Он отметил, что на выборах президента России с 19 до 20 часов проголосовало менее 1% избирателей.",https://tvrain.ru/news/mosgorduma-462568/
"24 April, 19:55",В Москве закрыли Усачевский рынок после проверки МЧС,Усачевский рынок в Москве закрыли по решению суда после совместной проверки прокуратуры и МЧС. Об этом РБК  сообщил  управляющий рынка Егор Гурник.,"«Это связано с совместной проверкой прокуратуры и МЧС: были выявлены незначительные нарушения по пожарной безопасности, которые уже частично устранены. Остальные устраняются», — рассказал он. Гурник добавил, что администрация рынка считает принятые меры избыточными. Он выразил надежду, что в скором времени они возобновят работу. По данным СПАРК, владельцем и гендиректором Усачевского рынка числится Александр Мартьянов. Уставной капитал компании составляет 10 тысяч рублей, выручка за 2016 год — 27,7 миллиона рублей, а чистый убыток — более 30 миллионов рублей. В Кемерово в торговом центре «Зимняя вишня» 25 марта произошел пожар. В результате погибли 60 человек, большинство из которых дети. По предварительной информации, причиной пожара  стало  короткое замыкание в проводке светильника. В МЧС  заявили , что торговый центр не проверяли на предмет противопожарной безопасности ни разу с 2012 года. Плановая проверка была запланирована на 2016 год, но когда сотрудники торгово центра пришли в «Зимнюю вишню» собственник показал документы, что они являются объектами малого предпринимательства и в их отношении действуют надзорные каникулы.",https://tvrain.ru/news/usachevskij_rynok-462525/
"25 April, 21:24",При наезде фургона на пешеходов в Торонто пострадала 90-летняя россиянка,"Гражданка России Александра Кожевникова пострадала при наезде фургона на пешеходов в канадском городе Торонто, которое произошло 23 апреля. Об этом  сообщает  ТАСС со ссылкой на российское посольство в Оттаве.","По словам дипломата, Кожевникова имела как российское, так и канадское гражданства. «Это Александра Степановна Кожевникова 1927 года рождения, ветеран труда», - отметили в посольстве.  Женщина «получила травмы от удара по касательной и от падения на землю». Ее сразу отвезли в больницу. Сейчас ее состояние стабильное, отметили в посольстве, родственники рассчитываю на скорую выписку. Наезд фургона на пешеходов на улице Янг на севере Торонто  произошел  23 апреля около 13.30 по местному времени (20.30 мск). Машина выехала на тротуар и начала сбивать людей. Погибли 10 человек, еще 15 получили ранения. В качестве одной из версий произошедшего полиция  рассматривает  теракт.",https://tvrain.ru/news/naezd_furgona_na_peshehodov_rossijanka-462611/
"25 апреля, 11:32",«МК»: в Подмосковье школьник покончил с собой после проверки ФСБ,"В Подмосковье покончил с собой 17-летний подросток,  сообщает  «Московский комсомолец» со ссылкой на собственные данные и учителей погибшего. По сведениям издания, он проводил дома химические опыты и на это жаловались соседи, а незадолго до гибели к нему приходили сотрудники ФСБ. В предсмертной записке подросток якобы написал, что «государству не нужны одаренные люди» и их «душат проверками».","Молодого человека нашли мертвым вечером 23 апреля. Он учился в колледже с физико-математическим уклоном. Преподаватель колледжа рассказала газете, что подросток не раз побеждал на областных и всероссийских олимпиадах по химии. При этом она добавила, что он был ранимым и «сильно переживал каждую свою неудачу». Дома у погибшего была мини-лаборатория. Опыты, которые он проводил, «нередко заканчивались взрывами», указывает «МК». Из-за жалоб соседей к нему пришли сотрудники ФСБ, которые провели проверку и взяли с него и его родителей подписку о неразглашении ее результатов. Когда именно это было, не уточняется. В Центре общественных связей ФСБ Дождю не смогли оперативно прокомментировать эту информацию. Дождь направил запрос, ответа на него на момент публикации не поступило.",https://tvrain.ru/news/olimpiad_po_himii-462559/
"26 April, 13:26",Шувалов ответил на вопрос о желании работать в правительстве,"Первый вице-премьер Игорь Шувалов заявил, что готов работать там, где ему предложит президент России. Так он ответил на вопрос, хочет ли он и дальше работать в правительстве, передает « Интерфакс ».","«Я хочу работать там, где скажет президент. Я любой работе рад, которую даст президент», — сказал Шувалов. Ранее Дождю  стало известно , что в руководстве страны обсуждают уход Шувалова с поста вице-премьера во время майских ротаций. Собеседники Дождя в аппарате кабинета министров и в Кремле рассказали, что Шувалов не хочет оставаться на своей должности в новом составе правительства. Знакомый Шувалова рассказал Дождю, что главная причина ухода — желание самого вице-премьера. По словам собеседника в аппарате правительства, Шувалов давно просился в отставку у президента Владимира Путина и недавно получил добро. После ухода из правительства Шувалов может получить должность в руководстве МГУ. Человек, близкий к правительству, рассказал, что Шувалов мог бы возглавить проект МГУ — Научно-технологическую долину, на концепцией которого работал Фонд Катерины Тихоново, которую СМИ и Минфин США называли дочерью Владимира Путина. Среди других вариантов будущего места работы Шувалова собеседники называют бизнес или другую высокую государственную должность, например, в руководстве Банка России.",https://tvrain.ru/news/shuvalov-462645/
"25 April, 11:46",В Армении возобновились массовые акции протеста,"В Ереване возобновились массовые акции протеста, передает корреспондент Дождя. Это произошло после провала переговоров оппозиции с временно исполняющим обязанности премьер-министра Кареном Карапетяном.","По оценке корреспондента Дождя, в новой акции протеста участвуют несколько десятков тысяч человек. Они перекрыли движение по центру Еревана, автомобилисты их поддерживают. Среди своих новых требований они называют уход правящей Республиканской партии Армении. По словам лидера протестного движения Никола Пашиняна, партия «не понимает ситуации» и «должна уйти». Накануне он объявил о проведении новой акции протеста. Протесты в Армении начались 13 апреля. Митингующие требовали отставки премьер-министра Сержа Саргсяна, который занял эту должность после отставки с поста президента страны. 23 апреля Саргсян подал в отставку, признав правоту митингующих и их лидера Никола Пашиняна. В 2015 году в Армении провели конституционную реформу, после которой полномочия премьер-министра были расширены, а президент сохранил представительские функции. Саргсян был президентом Армении с 2008 по 2018 годы.",https://tvrain.ru/news/v_armenii_vozobnovilis-462564/
"25 April, 20:47",Мединский поддержал ходатайство СК о переводе Малобродского под домашний арест,"Министр культуры Владимир Мединский поддержал ходатайство следствия выпустить из СИЗО бывшего директора «Гоголь-центра» Алексея Малобродского, передает «Интерфакс».","«Рад, что в СК возобладала позиция гуманизма», — отметил Мединский. Он подчеркнул, что надеется на гуманное решение суда по делу о хищениях в «Седьмой студии». По словам Мединского, в министерство культуры недавно обращались от имени Союза театральных деятелей Александр Калягин и Сергей Женовач. Они тоже просили «за Малобродского». «Мы эти просьбы, соответствующую позицию нашего ведомства, довели до правоохранительных органов», — рассказал Мединский. Ранее Следственный комитет  сообщил , что решил перевести Малобродского под домашний арест в связи с его возрастом и «состоянием здоровья». Соответствующее ходатайство СК направил в Басманный суд. По словам пресс-секретаря суда Юноны Царевой, заседание по его рассмотрению состоится 27 апреля. Малобродский находится в СИЗО с июня 2017 года. Его обвиняют в хищении бюджетных денег, выделенных на театральный проект «Платформа», которым занималась «Седьмая студия». По этому же делу проходят также режиссер и основатель «Седьмой студии» Кирилл Серебренников, бывший гендиректор «Седьмой студии» Юрий Итин, бывший главный бухгалтер Нина Масляева и директор РАМТ Софья Апфельбаум. Их всех суд уже отправил под домашний арест. Еще одна фигурантка дела — продюсер Екатерина Воронова — объявлена в розыск.",https://tvrain.ru/news/medinskij_malobrodskiy-462605/
