Date,Title,articleLead,articleText,url"26 April, 00:06",Российские дипломаты встретились с лидером протестов в Армении,"Российские дипломаты встретились с лидером протестного движения в Армении Николом Пашиняном. Об этом в фейсбуке  написало  посольство России в Армении. Пашинян сообщил, что встречался с представителями России, отметив, что они пообещали, что Москва «не будет вмешиваться во внутренние дела Армении».","На встрече, которая прошла в самом посольстве, присутствовали, помимо Пашиняна, его соратник Арарат Мирзоян и Тигран Авинян, пресс-секретарь партии «Гражданский договор», лидером которой является Пашинян. Дипломаты призвали организаторов протестных акций «к конструктивному диалогу с действующими властями и другими политическими силами», говорится в сообщении посольства. В диппредставительстве подчеркнули, что при решении ситуации должны учитывать интересы всех граждан Армении.  Пашинян сообщил о том, что встретился с официальными представителями России, ранее в среду во время многотысячного митинга на площади Республики в центре Еревана. «Сегодня я встречался с официальными представителями России и получил конкретные заверения о том, что Москва не будет вмешиваться во внутренние дела Армении», — сказал Пашинян ( цитата  по «Интерфаксу»). Протесты в Ереване продолжаются с 13 апреля. 22 апреля прошли самые масштабные протесты, в которых, по подсчетам оппозиции, участвовали более 150 тысяч человек. На следующий день, 23 апреля, бывший президент Армении Серж Саргсян, против назначения которого на пост премьер-министра протестовали митингующие,  подал  в отставку. 25 апреля Пашинян  объявил  о продолжении акций в стране. Новым требованием протестующие  называют  уход правящей Республиканской партии Армении.",https://tvrain.ru/news/rossijskie_diplomaty_v_armenii-462622/
"25 April, 15:51",«Репортеры без границ»: уровень свободы прессы в России снизился до показателей 30-летней давности,Уровень свободы СМИ в России снизился до показателей тридцатилетней давности. Об этом  сообщается  в докладе «Репортеров без границ» к рейтингу свободы прессы в мире за 2018 год.,"Россия находится в рейтинге на 148 месте из 180, как и в прошлом году. В докладе отмечается, что она не опустилась ниже из-за всеобщей мировой деградации свободы прессы в мире. Тем не менее, ситуация со свободой СМИ в стране продолжает ухудшаться. «Репортеры без границ» обращают внимание на то, что российские власти усилили контроль над интернетом из-за роста протестов перед выборами президента России в 2018 году. Кроме того, Россия расширяет «пропагандистку сеть» с помощью телеканала Russia Today и агентства Sputnik. «При этом все это не мешает Москве заявлять о себе на международной сцене как об альтернативной модели в области информации», — говорится в докладе. Рейтинг свободы прессы в мире возглавили Норвегия, Швеция и Нидерланды. На последнем месте оказалась Северная Корея. Организация отмечает тенденцию роста враждебности к СМИ со стороны политических лидеров во всем мире. По словам правозащитников, теперь это характерно не только для стран с авторитарными режимами. Все больше демократически избранных лидеров воспринимают СМИ как противников. В пример «Репортеры без границ» приводят президента США Дональда Трампа.",https://tvrain.ru/news/reportery_bez_granits-462584/
"25 April, 14:39","Минобороны показало обломки ракет, якобы сбитых при ударе международной коалиции по Сирии","Генштаб ВС России предъявил журналистам фрагменты крылатых ракет, выпущенных по Сирии 14 апреля силами ВС США, Великобритании и Франции, которые, как утверждают в Москве и Дамаске, были сбиты сирийскими ПВО. Об этом  сообщает  «Интерфакс».","Российское министерство обороны представило обещанные доказательства того, что часть американских ракет сирийцы сбили. Это - остатки тех самых ""хороших, новых и умных"" ракет от Трампа.  pic.twitter.com/ls0FWqKBEC «На выставке представлены элементы крылатых ракет морского базирования производства США „Томагавк“ и крылатые ракеты воздушного базирования производства Англии и Франции SCALP и Storm Shadow», — заявил специалист в области противовоздушной обороны Генштаба Сергей Безногих. В числе экспонатов оказались крупные элементы и самих ракет, и их двигательных установок, и космической радионавигационной системы, уточнил он. «Хорошее состояние элементов, отсутствие очагов возгорания говорит о явном воздействии именно средств противовоздушной обороны на крылатые ракеты. Наличие сквозных отверстий от поражающих элементов на обшивке крылатых ракет явно характеризует именно огневое воздействие зенитных управляемых ракет ПВО», — добавил эксперт. Ранее 25 апреля начальник Главного оперативного управления российского Генштаба Сергей Рудской  сообщил , что 14 апреля ПВО Сирии сбили 46 крылатых ракет США и союзников, запущенных в сторону Дамаска. Сирийские ПВО уничтожили ракеты в пяти районах перехвата к западу и к востоку от города, уточнил Рудской. 14 апреля США, Франция и Британия  нанесли  удары по объектам, связанных с химическим оружием в Сирии. Приказ об этом отдал президент США Дональд Трамп. Удары стали ответом на предполагаемое использование химического оружия в городе Дума. Международная коалиция считает, что сирийские правительственные силы применили там запрещенные отравляющие вещества. Жертвами стали более 40 человек. В Москве утверждают, что химической атаки в Думе не было, а фото- и видеоматериалы о ней являются инсценировкой. Вскоре после ударов Пентагон заявил, что союзники «успешно поразили каждую цель». По словам военных, тремя главными целями ударов были научно-исследовательский центр в районе Дамаска, хранилище химоружия к западу от Хомса и химический склад-хранилище. В российском Минобороны заявили, что сирийские ПВО сбили две трети из ста выпущенных ракет, российские ПВО в отражении атаки не участвовали. Две неразорвавшиеся ракеты сирийские военные передали российской стороне, их отправили в Россию самолетом для изучения,  сообщал  ТАСС со ссылкой на источник в Минобороны Сирии.",https://tvrain.ru/news/genshtab_otkryl_vystavku-462578/
"25 April, 05:00",Сенат США одобрил кандидатуру генерала Накасоне на пост главы АНБ,"Сенат в США одобрил кандидатуру генерал-лейтенанта Пола Накасоне на пост главы Агентства национальной безопасности (АНБ) и киберкомандования,  сообщает  The Hill.","Накасоне в должности главы АНБ будет контролировать сбор разведывательных данных за рубежом и контрразведку внутри США. С 2014 года этот пост занимал Майкл Роджерс, который в начале января сообщил о планах уйти в отставку. Ранее на слушаниях в сенате по вопросу его назначения на пост главы АНБ Накасоне попросили разъяснить свои взгляды в отношении России. Генерал заявил, что, по его мнению, Россия ожидает от США серьезной реакции на кибератаки и предполагаемое вмешательство в президентские выборы.«Они (Россия и Китай) не думают, что произойдет что-то серьезное», — сказал Накасоне на заседании комитета сената по делам вооруженных сил. «Мы представляемся (им) кибермальчиком для биться для всего мира... Наши противники не видят нашего ответа с ясностью, достаточной для того, чтобы их поведение изменилось», — отметил он. Кандидатуру Накасоне на пост главы АНБ президент Дональд Трамп предложил Конгрессу в середине февраля.  Накасоне — участник военных операций в Афганистане и Ираке. Звание генерал-лейтенанта он получил в 2016 году. Советник Трампа по кибербезопасности Роб Джойс называл его «исключительным лидером для двух особых организаций, у которого есть значительный опыт работы с кибертехнологиями».",https://tvrain.ru/news/an-462549/
"25 April, 16:53",Gmail ввел функцию удаляющихся сообщений,"Сервис электронной почты Gmail 25 апреля объявил о вводе новых функций, связанных с безопасностью, среди которых исчезающие сообщения и сообщения, на которые можно установить пин-код. Об этом пишет  CNN  и  The Verge . Обновления станут доступны «в ближайшие недели».","Срок действия сообщения можно установить от 1 дня до 5 лет и потребовать, чтобы получатель вводил пароль, отправленный на свой телефон, прежде чем он сможет его прочитать. Электронные письма также можно будет отправить в конфиденциальном режиме, который не позволяет получателю пересылать, копировать или распечатывать сообщение. В любой момент можно отозвать электронное письмо. Пользователь также сможет отправлять сообщения, защищенные PIN-кодом, отправленным на телефон получателя.  Инструменты работают даже с сообщениями электронной почты, отправленными на учетные записи, отличные от Gmail. При этом пользователи все равно смогут делать принтскрин сообщения. «Очевидно, что это не предотвратит преднамеренное распространение данных из таких писем, но Google считает, что есть множество ситуаций, когда люди случайно или невольно отправляют информацию не тому человеку, и это проблема, которую компания надеется решить», — пишет The Verge. Вместе с обновлениями безопасности появятся и функции для организации почтового ящика. Gmail будет показывать в топе списка писем три непрочитанных, которые он распознает как самые важные. На мобильном уведомления о входящих сообщениях можно будет ограничить только важными сообщениями.",https://tvrain.ru/news/gmail_vvel_funktsiju_udaljajuschihsja_soobschenij-462582/
"25 апреля, 23:36",Совет при Минобрнауки заявил о риске срыва научной деятельности из-за блокировок Роскомнадзора,"Совет по науке при Минобрнауки сообщил о сбоях в работе сайтов, без доступа к которым невозможна полноценная научная деятельность. Ученые связывают это с блокировкой Роскомнадзором мессенджера Telegram. Об этом  говорится  в заявлении совета, опубликованном на его официальном сайте.","Сбои коснулись службы поиска в текстах научных статей Google Scholar, библиотеки научного издательства Elsevier, сервиса для работы с библиографиями в научных статьях Mendeley, службы планирования совещаний и конференций Doodle, а также нескольких других научных сервисов. По словам ученых, сбои нанесли «серьезнейший ущерб для научной работы», так как для исследований требуется постоянный доступ к научным публикациям. «Совет считает, что именно Роскомнадзор, а не конкретные интернет-провайдеры, несет всю полноту ответственности за сложившуюся ситуацию», — отметили в Совете. Там подчеркнули, что ученые требуют решить проблему как можно скорее, иначе это может обернуться срывом научной деятельности по всей стране. Ранее Совет Общества научных работников (ОНР)  обратился  к премьер-министру Дмитрию Медведеву с аналогичным требованием. Ученые тоже заявляли о сбоях в работе научных и образовательных ресурсов из-за блокировки Роскомнадзора. Сбои в работе различных сервисов связаны с решением суда заблокировать Telegram в России. Его объясняют отказом мессенджера предоставить ФСБ ключи шифрования к переписке пользователей. 16 апреля регулятор приступил к блокировке Telegram. Роскомнадзор уже заблокировал более 18 млн IP-адресов Google, Amazon, Microsoft и Digital Ocean, которые Telegram использует для обхода запрета.",https://tvrain.ru/news/sovet_po_nauke_pri_minobrnauki-462621/
"25 April, 16:51","Росфинмониторинг нашел депутатов и губернаторов, связанных с «панамскими» и «райскими» офшорами","Росфинмониторинг проанализировал информацию из «панамского» и «райского» офшорных досье и обнаружил, что с ними связаны представители губернаторского и депутатского корпуса, а также «руководящего состава органов исполнительной власти». Об этом глава ведомства Юрий Чиханчин заявил на Евразийском антикоррупционном форуме,  передает  РБК.","«Анализ данной информации [в офшорных досье] показал, что гражданам России подконтрольны тысячи иностранных компаний, проходящих по данным досье. С их участием выявлено множество сомнительных финансовых операций на общую сумму в несколько миллиардов рублей», — заявил Чиханчин. Он добавил, что среди таких россиян оказался «ряд публичных должностных лиц, в том числе из губернаторского, депутатского корпуса, руководящего состава органов исполнительной власти». По словам Чиханчина, эта информация направлена в правоохранительные органы. Имена россиян, у которых нашли связи с компаниями из офшорных досье, глава Росфинмониторинга не назвал. «Панамское досье» и «Райское досье» — это документы офшорных регистраторов Mossack Fonseca и Appleby, которые после утечки изучал и публиковал Международный консорциум журналистов-расследователей (ICIJ) и Центр по исследованию коррупции и организованной преступности (OCCRP).  «Панамское досье» было  обнародовано  весной 2016 года. В его бумагах упоминаются тогдашний министр экономического развития Алексей Улюкаев, пресс-секретарь президента Дмитрий Песков, бывший заместитель управляющего делами президента Иван Малюшин и вице-мэр Москвы Максим Ликсутов. Улюкаеву и Пескову офшоры напрямую не принадлежат, офшорные компании были зарегистрированы на их близких родственников.  «Райское досье»  содержит  данные юридической компании Appleby, которая оформляет офшорные сделки на Бермудах, Кайманах и других райских островах. Его обнародовали осенью 2017 года. В нем фигурирут бизнесмены Роман Абрамович и Алишер Усманов, бывшая жена главы «Роснефти» Игоря Сечина Марина, жена и сын первого вице-премьера России Игоря Шувалова, депутатов Госдумы Алексея Езубова и Владимира Блоцкого.",https://tvrain.ru/news/rosfinmonitoring-462585/
